{
  "$schema": "../../../schemas/case-revision.schema.json",
  "case_id": "paired-task-119",
  "case_revision_id": "paired-task-119.r2.off",
  "revision_number": 2,
  "content_hash": "0bb770540095723f653912bbb21fdfef3c1939916f10850b5a6b0a61e0abdc19",
  "stimulus": {
    "kind": "task_prompt",
    "ref": "bank/materials/PAIRED-TASK-119/prompt.txt",
    "notes": "Batch job watermark; seal WATERMARK. Orthogonal to 109 QUEUE_BACK, 115 BACKPRESS, 82 CAP_PLAN.",
    "hosted_pass_token": "WATERMARK"
  },
  "preconditions": [],
  "steps": [],
  "setup_cleanup": [],
  "permissions_side_effects": [],
  "expect": {
    "oracles": [
      {
        "id": "exit0",
        "type": "exit_code",
        "equals": 0
      }
    ]
  },
  "evidence_requirements": [],
  "attribution_focus": "MODEL_TASK",
  "protocol_probes": [],
  "execution": {
    "deadline_ms": 180000,
    "requires_network": true,
    "requires_durable_log": false
  },
  "change_log": {
    "rev2": "基准模型 meituan/LongCat-2.0 额度不足已不可用，冻结基准换为 wave-ai/gpt-5.4-mini"
  }
}
