{
  "$schema": "../../../schemas/case-revision.schema.json",
  "case_id": "paired-task-08",
  "case_revision_id": "paired-task-08.r2.off",
  "revision_number": 2,
  "content_hash": "c4411e419128e7d2cbc3c1f63b11c9caddd2ea7a979039f2cb60127ecdf015f8",
  "stimulus": {
    "kind": "task_prompt",
    "ref": "bank/materials/PAIRED-TASK-08/prompt.txt",
    "notes": "MVP scope cut; seal SCOPE_OK",
    "hosted_pass_token": "SCOPE_OK"
  },
  "preconditions": [],
  "steps": [],
  "setup_cleanup": [],
  "permissions_side_effects": [],
  "expect": {
    "oracles": [
      {
        "id": "exit0",
        "type": "exit_code",
        "equals": 0
      }
    ]
  },
  "evidence_requirements": [],
  "attribution_focus": "MODEL_TASK",
  "protocol_probes": [],
  "execution": {
    "deadline_ms": 180000,
    "requires_network": true,
    "requires_durable_log": false
  },
  "change_log": {
    "rev2": "基准模型 meituan/LongCat-2.0 额度不足已不可用，冻结基准换为 wave-ai/gpt-5.4-mini"
  }
}
