{
  "$schema": "../../../schemas/case-revision.schema.json",
  "case_id": "paired-task-121",
  "case_revision_id": "paired-task-121.r3.on",
  "revision_number": 3,
  "content_hash": "f8c882bf6e47c110ac7e30572b343071ef321e3799399e31644cbef1fa0eb70b",
  "stimulus": {
    "kind": "task_prompt",
    "ref": "bank/materials/PAIRED-TASK-121/prompt.txt",
    "notes": "Retry storm suppression; seal RETRY_CAP. Orthogonal to 79 IDEMPOTENT, 113 IDEMP_REV, 84 RATE_LIMIT, 115 BACKPRESS.",
    "hosted_pass_token": "RETRY_CAP"
  },
  "preconditions": [],
  "steps": [],
  "setup_cleanup": [],
  "permissions_side_effects": [],
  "expect": {
    "oracles": [
      {
        "id": "exit0",
        "type": "exit_code",
        "equals": 0
      }
    ]
  },
  "evidence_requirements": [],
  "attribution_focus": "PROTOCOL",
  "protocol_probes": [
    "RuntimeStarted",
    "JournalEnvelope"
  ],
  "execution": {
    "deadline_ms": 180000,
    "requires_network": true,
    "requires_durable_log": true
  },
  "change_log": {
    "rev2": "基准模型 meituan/LongCat-2.0 额度不足已不可用，冻结基准换为 wave-ai/gpt-5.4-mini",
    "rev3": "协议探针换血：assistant_completed 属万象术 0.8 前 NDJSON 面，已消失；改用 2026-08-31 hosted 真跑实测命中的 EventStore Kind（RuntimeStarted / JournalEnvelope）"
  }
}
