{
  "$schema": "../../../schemas/case-revision.schema.json",
  "case_id": "paired-task-123",
  "case_revision_id": "paired-task-123.r2.off",
  "revision_number": 2,
  "content_hash": "7870ca55558bffedbccef1c83db5d2da69f94872e21891340afa5193bb1dec99",
  "stimulus": {
    "kind": "task_prompt",
    "ref": "bank/materials/PAIRED-TASK-123/prompt.txt",
    "notes": "Change freeze window; seal FREEZE_WIN. Orthogonal to 76 CANARY_OK, 101 BG_FLIP, 95 BLAST_RAD, 09 TRIAGE_OK.",
    "hosted_pass_token": "FREEZE_WIN"
  },
  "preconditions": [],
  "steps": [],
  "setup_cleanup": [],
  "permissions_side_effects": [],
  "expect": {
    "oracles": [
      {
        "id": "exit0",
        "type": "exit_code",
        "equals": 0
      }
    ]
  },
  "evidence_requirements": [],
  "attribution_focus": "MODEL_TASK",
  "protocol_probes": [],
  "execution": {
    "deadline_ms": 180000,
    "requires_network": true,
    "requires_durable_log": false
  },
  "change_log": {
    "rev2": "基准模型 meituan/LongCat-2.0 额度不足已不可用，冻结基准换为 wave-ai/gpt-5.4-mini"
  }
}
