{
  "$schema": "../../../schemas/case-revision.schema.json",
  "case_id": "paired-task-60",
  "case_revision_id": "paired-task-60.r2.off",
  "revision_number": 2,
  "content_hash": "1163756fcd0bd72af5603cd8297300ead1701dedc5a8fdce521ce623edcf9673",
  "stimulus": {
    "kind": "task_prompt",
    "ref": "bank/materials/PAIRED-TASK-60/prompt.txt",
    "notes": "Ordered multi-file edit plan; seal MULTI_FILE. Self-authored fill for coordination gap; orthogonal to TOUCH_MIN/IMPL_STEPS.",
    "hosted_pass_token": "MULTI_FILE"
  },
  "preconditions": [],
  "steps": [],
  "setup_cleanup": [],
  "permissions_side_effects": [],
  "expect": {
    "oracles": [
      {
        "id": "exit0",
        "type": "exit_code",
        "equals": 0
      }
    ]
  },
  "evidence_requirements": [],
  "attribution_focus": "MODEL_TASK",
  "protocol_probes": [],
  "execution": {
    "deadline_ms": 180000,
    "requires_network": true,
    "requires_durable_log": false
  },
  "change_log": {
    "rev2": "基准模型 meituan/LongCat-2.0 额度不足已不可用，冻结基准换为 wave-ai/gpt-5.4-mini"
  }
}
