{
  "$schema": "../../../schemas/case-revision.schema.json",
  "case_id": "paired-task-149",
  "case_revision_id": "paired-task-149.r3.on",
  "revision_number": 3,
  "content_hash": "119efbb67d106eeaad79bacc6c2f45a47d3536f0c8f4f0ef48e9050804dc5c07",
  "stimulus": {
    "kind": "task_prompt",
    "ref": "bank/materials/PAIRED-TASK-149/prompt.txt",
    "notes": "Cache penetration / bypass protection; seal CACHE_PEN. Orthogonal to 78 CACHE_INV, 114 HOT_KEY, 115 BACKPRESS.",
    "hosted_pass_token": "CACHE_PEN"
  },
  "preconditions": [],
  "steps": [],
  "setup_cleanup": [],
  "permissions_side_effects": [],
  "expect": {
    "oracles": [
      {
        "id": "exit0",
        "type": "exit_code",
        "equals": 0
      }
    ]
  },
  "evidence_requirements": [],
  "attribution_focus": "PROTOCOL",
  "protocol_probes": [
    "RuntimeStarted",
    "JournalEnvelope"
  ],
  "execution": {
    "deadline_ms": 180000,
    "requires_network": true,
    "requires_durable_log": true
  },
  "change_log": {
    "rev2": "基准模型 meituan/LongCat-2.0 额度不足已不可用，冻结基准换为 wave-ai/gpt-5.4-mini",
    "rev3": "协议探针换血：assistant_completed 属万象术 0.8 前 NDJSON 面，已消失；改用 2026-08-31 hosted 真跑实测命中的 EventStore Kind（RuntimeStarted / JournalEnvelope）"
  }
}
