{
  "$schema": "../../../schemas/case-revision.schema.json",
  "case_id": "paired-task-63",
  "case_revision_id": "paired-task-63.r2.off",
  "revision_number": 2,
  "content_hash": "9857184a3bc9305bc1034229146a447789e92d6f3ad846df5c7a8a8e833f948d",
  "stimulus": {
    "kind": "task_prompt",
    "ref": "bank/materials/PAIRED-TASK-63/prompt.txt",
    "notes": "Flag hot-path perf risk + one measurement; seal PERF_WATCH. Self-authored daily-coding fill; orthogonal to RISK_OK/VERIFY_OK.",
    "hosted_pass_token": "PERF_WATCH"
  },
  "preconditions": [],
  "steps": [],
  "setup_cleanup": [],
  "permissions_side_effects": [],
  "expect": {
    "oracles": [
      {
        "id": "exit0",
        "type": "exit_code",
        "equals": 0
      }
    ]
  },
  "evidence_requirements": [],
  "attribution_focus": "MODEL_TASK",
  "protocol_probes": [],
  "execution": {
    "deadline_ms": 180000,
    "requires_network": true,
    "requires_durable_log": false
  },
  "change_log": {
    "rev2": "基准模型 meituan/LongCat-2.0 额度不足已不可用，冻结基准换为 wave-ai/gpt-5.4-mini"
  }
}
