{
  "$schema": "../../../schemas/case-revision.schema.json",
  "case_id": "paired-task-114",
  "case_revision_id": "paired-task-114.r3.on",
  "revision_number": 3,
  "content_hash": "df2170a3ba21626524d57d14cd86558006ecef5fedfea0c08f931c2ab1505e92",
  "stimulus": {
    "kind": "task_prompt",
    "ref": "bank/materials/PAIRED-TASK-114/prompt.txt",
    "notes": "Hot key mitigation; seal HOT_KEY. Orthogonal to 78 CACHE_INV, 96 TENANT_ISO, 84 RATE_LIMIT.",
    "hosted_pass_token": "HOT_KEY"
  },
  "preconditions": [],
  "steps": [],
  "setup_cleanup": [],
  "permissions_side_effects": [],
  "expect": {
    "oracles": [
      {
        "id": "exit0",
        "type": "exit_code",
        "equals": 0
      }
    ]
  },
  "evidence_requirements": [],
  "attribution_focus": "PROTOCOL",
  "protocol_probes": [
    "RuntimeStarted",
    "JournalEnvelope"
  ],
  "execution": {
    "deadline_ms": 180000,
    "requires_network": true,
    "requires_durable_log": true
  },
  "change_log": {
    "rev2": "基准模型 meituan/LongCat-2.0 额度不足已不可用，冻结基准换为 wave-ai/gpt-5.4-mini",
    "rev3": "协议探针换血：assistant_completed 属万象术 0.8 前 NDJSON 面，已消失；改用 2026-08-31 hosted 真跑实测命中的 EventStore Kind（RuntimeStarted / JournalEnvelope）"
  }
}
