{
  "$schema": "../../../schemas/case-revision.schema.json",
  "case_id": "paired-task-153",
  "case_revision_id": "paired-task-153.r3.on",
  "revision_number": 3,
  "content_hash": "5caa46b9795cea2746c39f275aba4e7b410c57039e56865e18053d42e07db877",
  "stimulus": {
    "kind": "task_prompt",
    "ref": "bank/materials/PAIRED-TASK-153/prompt.txt",
    "notes": "Downstream dependency SLA alignment; seal DEP_SLA. Orthogonal to 135 TO_ALIGN, 77 ERR_BUDGET, 126 CIRCUIT_BR.",
    "hosted_pass_token": "DEP_SLA"
  },
  "preconditions": [],
  "steps": [],
  "setup_cleanup": [],
  "permissions_side_effects": [],
  "expect": {
    "oracles": [
      {
        "id": "exit0",
        "type": "exit_code",
        "equals": 0
      }
    ]
  },
  "evidence_requirements": [],
  "attribution_focus": "PROTOCOL",
  "protocol_probes": [
    "RuntimeStarted",
    "JournalEnvelope"
  ],
  "execution": {
    "deadline_ms": 180000,
    "requires_network": true,
    "requires_durable_log": true
  },
  "change_log": {
    "rev2": "基准模型 meituan/LongCat-2.0 额度不足已不可用，冻结基准换为 wave-ai/gpt-5.4-mini",
    "rev3": "协议探针换血：assistant_completed 属万象术 0.8 前 NDJSON 面，已消失；改用 2026-08-31 hosted 真跑实测命中的 EventStore Kind（RuntimeStarted / JournalEnvelope）"
  }
}
