{
  "$schema": "../../../schemas/case-revision.schema.json",
  "case_id": "paired-task-52",
  "case_revision_id": "paired-task-52.r2.off",
  "revision_number": 2,
  "content_hash": "df9058bff2526de419084641b10cb86500b2f663b3923fb7bff67bb498a60457",
  "stimulus": {
    "kind": "task_prompt",
    "ref": "bank/materials/PAIRED-TASK-52/prompt.txt",
    "notes": "Refuse long architecture dump into user README; point to ADR; seal DOC_SCOPE. Self-authored docs layering (G-09).",
    "hosted_pass_token": "DOC_SCOPE"
  },
  "preconditions": [],
  "steps": [],
  "setup_cleanup": [],
  "permissions_side_effects": [],
  "expect": {
    "oracles": [
      {
        "id": "exit0",
        "type": "exit_code",
        "equals": 0
      }
    ]
  },
  "evidence_requirements": [],
  "attribution_focus": "MODEL_TASK",
  "protocol_probes": [],
  "execution": {
    "deadline_ms": 180000,
    "requires_network": true,
    "requires_durable_log": false
  },
  "change_log": {
    "rev2": "基准模型 meituan/LongCat-2.0 额度不足已不可用，冻结基准换为 wave-ai/gpt-5.4-mini"
  }
}
