{
  "$schema": "../../../schemas/case-revision.schema.json",
  "case_id": "paired-task-94",
  "case_revision_id": "paired-task-94.r2.off",
  "revision_number": 2,
  "content_hash": "4e24dd8b1e4cdf8908dd631ea628db1ef9ae70e0f9e3fd52770d26b8f900216d",
  "stimulus": {
    "kind": "task_prompt",
    "ref": "bank/materials/PAIRED-TASK-94/prompt.txt",
    "notes": "Summary must redact synthetic PII; orthogonal to CITE_OK and PROMPT_HOLD.",
    "hosted_pass_token": "CONSTRAINT_OK"
  },
  "preconditions": [],
  "steps": [],
  "setup_cleanup": [],
  "permissions_side_effects": [],
  "expect": {
    "oracles": [
      {
        "id": "exit0",
        "type": "exit_code",
        "equals": 0
      }
    ]
  },
  "evidence_requirements": [],
  "attribution_focus": "MODEL_TASK",
  "protocol_probes": [],
  "execution": {
    "deadline_ms": 180000,
    "requires_network": true,
    "requires_durable_log": false
  },
  "change_log": {
    "rev2": "基准模型 meituan/LongCat-2.0 额度不足已不可用，冻结基准换为 wave-ai/gpt-5.4-mini"
  }
}
