{
  "$schema": "../../../schemas/case-revision.schema.json",
  "case_id": "paired-task-43",
  "case_revision_id": "paired-task-43.r2.off",
  "revision_number": 2,
  "content_hash": "473aecdffea5e308076bfb87816166cf549e372b780dbda61273d75a9cacd59c",
  "stimulus": {
    "kind": "task_prompt",
    "ref": "bank/materials/PAIRED-TASK-43/prompt.txt",
    "notes": "Short ADR draft structure; seal ADR_DRAFT. Inspired by Nygard ADR skeleton (self-authored).",
    "hosted_pass_token": "ADR_DRAFT"
  },
  "preconditions": [],
  "steps": [],
  "setup_cleanup": [],
  "permissions_side_effects": [],
  "expect": {
    "oracles": [
      {
        "id": "exit0",
        "type": "exit_code",
        "equals": 0
      }
    ]
  },
  "evidence_requirements": [],
  "attribution_focus": "MODEL_TASK",
  "protocol_probes": [],
  "execution": {
    "deadline_ms": 180000,
    "requires_network": true,
    "requires_durable_log": false
  },
  "change_log": {
    "rev2": "基准模型 meituan/LongCat-2.0 额度不足已不可用，冻结基准换为 wave-ai/gpt-5.4-mini"
  }
}
