{
  "$schema": "../../../schemas/case-revision.schema.json",
  "case_id": "paired-task-02",
  "case_revision_id": "paired-task-02.r6.off",
  "revision_number": 6,
  "content_hash": "b73f222684dc6716b499f7a5c6410f24e634ce88730284b9874784a26d32dde7",
  "stimulus": {
    "kind": "task_prompt",
    "ref": "bank/materials/PAIRED-TASK-02/prompt.txt",
    "hosted_pass_token": "yes",
    "notes": "Reply with exactly yes. Do not use tools."
  },
  "preconditions": [],
  "steps": [],
  "setup_cleanup": [],
  "permissions_side_effects": [],
  "expect": {
    "oracles": [
      {
        "id": "exit0",
        "type": "exit_code",
        "equals": 0
      }
    ]
  },
  "evidence_requirements": [],
  "attribution_focus": "MODEL_TASK",
  "protocol_probes": [],
  "execution": {
    "deadline_ms": 180000,
    "requires_network": true,
    "requires_durable_log": false
  },
  "change_log": {
    "rev6": "基准模型 meituan/LongCat-2.0 额度不足已不可用，冻结基准换为 wave-ai/gpt-5.4-mini"
  }
}
