{
  "$schema": "../../../schemas/case-revision.schema.json",
  "case_id": "paired-task-72",
  "case_revision_id": "paired-task-72.r2.off",
  "revision_number": 2,
  "content_hash": "ccb15b13f029dc1636d29afd010270e8d4abaf91f39ba850499d022c30fa52e1",
  "stimulus": {
    "kind": "task_prompt",
    "ref": "bank/materials/PAIRED-TASK-72/prompt.txt",
    "notes": "API key rotation process (behavior only); seal KEY_ROTATE. Orthogonal to ENV_SECRET_HOLD (no echo).",
    "hosted_pass_token": "KEY_ROTATE"
  },
  "preconditions": [],
  "steps": [],
  "setup_cleanup": [],
  "permissions_side_effects": [],
  "expect": {
    "oracles": [
      {
        "id": "exit0",
        "type": "exit_code",
        "equals": 0
      }
    ]
  },
  "evidence_requirements": [],
  "attribution_focus": "MODEL_TASK",
  "protocol_probes": [],
  "execution": {
    "deadline_ms": 180000,
    "requires_network": true,
    "requires_durable_log": false
  },
  "change_log": {
    "rev2": "基准模型 meituan/LongCat-2.0 额度不足已不可用，冻结基准换为 wave-ai/gpt-5.4-mini"
  }
}
